{
  "schemaVersion": 1,
  "kind": "TagObserved",
  "recordedAt": "2026-08-13T08:11:14Z",
  "source": {
    "type": "github-actions",
    "workflow": "promote from quarantine / quarantine/python",
    "runUrl": "https://github.com/toddysm/cssc-framework/actions/runs/31680892136",
    "runId": "31680892136",
    "runAttempt": "1"
  },
  "occurrence": {
    "registry": "ghcr.io",
    "repository": "toddysm/golden/python"
  },
  "tag": "sha256-8363e32480e592b29d8733ef4f20f2a69b21c05f985b6e4386827d19e4703ac2",
  "digest": "sha256:8b0e222d0fda8cf48aa63282594a398e45325262079afb05405c5b3a627ff0e5",
  "observedAt": "2026-08-13T08:11:14Z",
  "id": "sha256:5a1d35a4dd52bcf240f3fc35cc3a5f65e87e17a807fa60eda2003c2f86c97994"
}
