{
  "schemaVersion": 1,
  "kind": "TagObserved",
  "recordedAt": "2026-08-10T21:21:00Z",
  "source": {
    "type": "github-actions",
    "workflow": "build / cssc-dashboard",
    "runUrl": "https://github.com/toddysm/cssc-framework/actions/runs/31433115524",
    "runId": "31433115524",
    "runAttempt": "1"
  },
  "occurrence": {
    "registry": "ghcr.io",
    "repository": "toddysm/apps/cssc-dashboard/issues-service"
  },
  "tag": "0.1.2-4250b4e",
  "digest": "sha256:dcc4813405ccdd59fe21cb9d0dae0800ceadb9102708db8fdd10b4052a0c9bc8",
  "observedAt": "2026-08-10T21:21:00Z",
  "id": "sha256:ed9db444e5ec85178aa85bde285bebbba68914fd9da1ed21aae6f542a3e34e64"
}
