{
  "schemaVersion": 1,
  "kind": "TagObserved",
  "recordedAt": "2026-08-10T18:47:56Z",
  "source": {
    "type": "github-actions",
    "workflow": "build / cssc-dashboard",
    "runUrl": "https://github.com/toddysm/cssc-framework/actions/runs/31420554885",
    "runId": "31420554885",
    "runAttempt": "1"
  },
  "occurrence": {
    "registry": "ghcr.io",
    "repository": "toddysm/apps/cssc-dashboard/issues-service"
  },
  "tag": "0",
  "digest": "sha256:ab39c0d4a13c0576bf5e0be30fa90b83517386fe32fa0e1cb5d306a7442c74c2",
  "observedAt": "2026-08-10T18:47:56Z",
  "id": "sha256:9a5b1d5d7ed6f05e4dd9d01e58bd362d3985b0961f22dab9afe16b2949a1f371"
}
