{
  "schemaVersion": 1,
  "kind": "TagObserved",
  "recordedAt": "2026-08-15T03:14:39Z",
  "source": {
    "type": "github-actions",
    "workflow": "build / cssc-dashboard",
    "runUrl": "https://github.com/toddysm/cssc-framework/actions/runs/31861133712",
    "runId": "31861133712",
    "runAttempt": "1"
  },
  "occurrence": {
    "registry": "ghcr.io",
    "repository": "toddysm/apps/cssc-dashboard/packages-service"
  },
  "tag": "0.1.2",
  "digest": "sha256:977ef052ba7583f12e2a60e7fee3620e0a5e0bccdd0795d3978830d988890baa",
  "observedAt": "2026-08-15T03:14:39Z",
  "id": "sha256:bbd3758efc1b7237dd393c20a41f8881516712215042d4879f9289bc1ec670f5"
}
