{
  "schemaVersion": 1,
  "kind": "TagObserved",
  "recordedAt": "2026-08-14T03:08:11Z",
  "source": {
    "type": "github-actions",
    "workflow": "build / cssc-dashboard",
    "runUrl": "https://github.com/toddysm/cssc-framework/actions/runs/31765657652",
    "runId": "31765657652",
    "runAttempt": "1"
  },
  "occurrence": {
    "registry": "ghcr.io",
    "repository": "toddysm/apps/cssc-dashboard/graph-service"
  },
  "tag": "0",
  "digest": "sha256:4c4c162b9a069a824b95f1c1efcb75d7da937ffb8f4698a427f3ac08f00114b1",
  "observedAt": "2026-08-14T03:08:11Z",
  "id": "sha256:e948b304513f996a2d7462def63a24f3cc7e9fed064f3a9ec66bca3bfdaf13ef"
}
