{
  "schemaVersion": 1,
  "kind": "TagObserved",
  "recordedAt": "2026-08-11T08:09:53Z",
  "source": {
    "type": "github-actions",
    "workflow": "promote from quarantine / quarantine/openjdk",
    "runUrl": "https://github.com/toddysm/cssc-framework/actions/runs/31471967809",
    "runId": "31471967809",
    "runAttempt": "1"
  },
  "occurrence": {
    "registry": "ghcr.io",
    "repository": "toddysm/golden/openjdk"
  },
  "tag": "sha256-1d9af36d585cd97eadfc19a6abb27835edb4b444f7cce79475ce0d5747094b72",
  "digest": "sha256:928da5128f32e52e1412d06a83cef222791e57a72256db734e266594d92de320",
  "observedAt": "2026-08-11T08:09:53Z",
  "id": "sha256:825049ab1b29e321f5393eae6cb86b19802f01b979773dd1ad5a21503ee57d77"
}
